22260014007	M9-T3904M_LSBEN	M&S Fenton Large Sofa Bed	"Stylish, contemporary look sofa with an elegant, classic shape with bolster cushions. 
Seat cushions have a fibre wrap on shape-retaining foam for added comfort and support. 
Fabric options have reversible cushions and the feet are solid birch finished with a dark stain. 
The arms are removable for ease of delivery. Images displayed here act as a guide and may not be representative of the finished item. 
Fabrics are overlayed onto model images, so actual seams and pattern match may differ from what is shown. 
Dimensions: Mattress- L178 x W132 x D5cm, Height: 90 cm, Height In: 35.4 in, Width: 218 cm, Width In: 85.8 in, Depth: 103 cm, Depth In: 40.6 in, Seat Height: 51 cm, Arm Height: 71 cm, Top back Rail Height: 76 cm, Feet Height: 9 cm, C Dimension: 66 cm, Length of Recliner: 235 cm,
Item details: 99% of our upholstery is manufactured in the UK, Back cushions are made up of polyester fibre,Can have armcaps- yes, 
Feet are solid hardwood with a medium finish, Includes bolster cushions 2 fibre and feather-filled arm bolsters, 
More information: Our delivery team will unpack and position in a room of your choice for free, Mattress Type: SPRUNG"	1499.00 GBP		GB:::3.50	35 days	http://asset1.marksandspencer.com/is/image/mands/T39_0420D_VV_LSBEN_IS?$PDP_MAXI_ZOOM$	http://www.marksandspencer.com/fenton-large-sofa-bed/p/p22098467006	http://pixel.everesttech.net/2750/cq?ev_sid=3&ev_ln={keyword}&ev_crx={creative}&ev_mt={matchtype}&ev_n={network}&ev_ltx={adtype}:Fenton+Large+Sofa+Bed&ev_plx=22260014007&ev_ptid={product_partition_id}&ev_cty={product_country}&ev_lan={product_language}&ev_dvc={device}&ev_dvm={devicemodel}http://servedby.flashtalking.com/click/1/37735;928990;369310;252;0/?ft_section=22260014007&ft_keyword=googleshopping&url=http%3A%2F%2Fwww%2Emarksandspencer%2Ecom%2Ffenton%2Dlarge%2Dsofa%2Dbed%2Fp%2Fp22098467006?extid=ps_gglpla_UK_Gen_,Home+%26+Furniture+_PLAHome+%26+Furniture+%2D%2D%3E+Furniture+%2D%2D%3E+Shop+By+Type+%2D%2D%3E+Sofas+%26+Armchairs+%2D%2D%3E+Sofas+%2D%2D%3E+Sofas_M%26S+Fenton+Large+Sofa+Bed+BAMBOO+4+Seater+Sofa	in stock	Home & Furniture > Furniture > Shop By Type > Sofas & Armchairs > Sofas > Sofas	Furniture > Sofas	new	M9-T3904M_LSBEN	M&S	Beige	4 Seater Sofa	Regular	UK	Unisex	Adult			TRUE	FALSE	Home & Furniture		Sofas	Sofas & Armchairs			11	22260014007	M9-T3904M_LSBEN	M&S Fenton Large Sofa Bed	1499.00 GBP	Home & Furniture	Furniturehead
